{
  "$schema": "https://licoarc.com/spec/schemas/security-claims.schema.json",
  "$id": "https://licoarc.com/spec/v1/security/claims.json",
  "registryVersion": "licoarc.security-claims.v1",
  "lifecycle": "Candidate",
  "claimStatusValues": [
    "unproved",
    "proved",
    "explicit-nonclaim"
  ],
  "claims": [
    {
      "id": "SEC-001",
      "property": "hybrid-ake-key-secrecy",
      "scope": "pairwise-establishment",
      "adversary": [
        "A1",
        "A2"
      ],
      "assumptions": [
        "ideal-hybrid-constructor",
        "at-least-one-hybrid-component-uncompromised",
        "atomic-durable-compare-and-commit"
      ],
      "proofModel": null,
      "proofLemma": null,
      "counterexampleStatus": "not-run",
      "residualRisk": "computational-hybrid-security-and-live-session-compromise-outside-symbolic-claim",
      "status": "unproved"
    },
    {
      "id": "SEC-002",
      "property": "mutual-endpoint-authentication",
      "scope": "pairwise-establishment",
      "adversary": [
        "A0",
        "A1",
        "A6"
      ],
      "assumptions": [
        "ideal-dual-signature-authentication",
        "authenticated-peer-key-acceptance",
        "atomic-durable-compare-and-commit"
      ],
      "proofModel": null,
      "proofLemma": null,
      "counterexampleStatus": "not-run",
      "residualRisk": "computational-primitives-and-peer-key-acceptance-outside-symbolic-model",
      "status": "unproved"
    },
    {
      "id": "SEC-003",
      "property": "classical-pq-hybrid-robustness",
      "scope": "pairwise-establishment",
      "adversary": [
        "A2"
      ],
      "assumptions": [
        "ideal-hybrid-constructor",
        "at-least-one-hybrid-component-uncompromised",
        "source-bound-transcript"
      ],
      "proofModel": null,
      "proofLemma": null,
      "counterexampleStatus": "not-run",
      "residualRisk": "computational-combiner-security-outside-symbolic-model",
      "status": "unproved"
    },
    {
      "id": "SEC-004",
      "property": "unknown-key-share-resistance",
      "scope": "pairwise-establishment",
      "adversary": [
        "A1"
      ],
      "assumptions": [
        "source-bound-transcript",
        "ideal-hybrid-constructor",
        "atomic-durable-compare-and-commit"
      ],
      "proofModel": null,
      "proofLemma": null,
      "counterexampleStatus": "not-run",
      "residualRisk": "computational-transcript-and-combiner-security-outside-symbolic-model",
      "status": "unproved"
    },
    {
      "id": "SEC-005",
      "property": "key-compromise-impersonation-boundary",
      "scope": "pairwise-establishment",
      "adversary": [
        "A4",
        "A5"
      ],
      "assumptions": [
        "strict-dual-signature-authentication",
        "authenticated-peer-key-acceptance",
        "responder-identity-and-prekey-not-compromised"
      ],
      "proofModel": null,
      "proofLemma": null,
      "counterexampleStatus": "not-run",
      "residualRisk": "responder-identity-or-prekey-compromise-is-the-explicit-impersonation-boundary",
      "status": "unproved"
    },
    {
      "id": "SEC-006",
      "property": "protocol-line-content-binding",
      "scope": "line-admission-and-handshake",
      "adversary": [
        "A0",
        "A1"
      ],
      "assumptions": [
        "source-bound-protocol-line-content-identity",
        "authenticated-fixed-context-transcript"
      ],
      "proofModel": null,
      "proofLemma": null,
      "counterexampleStatus": "not-run",
      "residualRisk": "endpoint-signing-key-compromise-or-compromised-local-authority-input-outside-symbolic-claim",
      "status": "unproved"
    },
    {
      "id": "SEC-007",
      "property": "protection-profile-content-binding",
      "scope": "profile-admission-and-handshake",
      "adversary": [
        "A0",
        "A1"
      ],
      "assumptions": [
        "source-bound-profile-content-identity",
        "authenticated-fixed-context-transcript"
      ],
      "proofModel": null,
      "proofLemma": null,
      "counterexampleStatus": "not-run",
      "residualRisk": "endpoint-signing-key-compromise-or-compromised-local-authority-input-outside-symbolic-claim",
      "status": "unproved"
    },
    {
      "id": "SEC-008",
      "property": "session-independence",
      "scope": "pairwise-sessions",
      "adversary": [
        "A1",
        "A3"
      ],
      "assumptions": [
        "fresh-independent-hybrid-components",
        "ideal-hybrid-constructor",
        "atomic-durable-compare-and-commit"
      ],
      "proofModel": null,
      "proofLemma": null,
      "counterexampleStatus": "not-run",
      "residualRisk": "full-live-compromise-of-the-target-session-outside-claim",
      "status": "unproved"
    },
    {
      "id": "SEC-009",
      "property": "initial-forward-secrecy",
      "scope": "pairwise-establishment",
      "adversary": [
        "A3",
        "A5"
      ],
      "assumptions": [
        "one-time-prekey-consumption",
        "post-accept-ephemeral-erasure",
        "atomic-durable-compare-and-commit"
      ],
      "proofModel": null,
      "proofLemma": null,
      "counterexampleStatus": "not-run",
      "residualRisk": "pre-accept-and-live-session-compromise-outside-claim",
      "status": "unproved"
    },
    {
      "id": "SEC-010",
      "property": "double-ratchet-forward-secrecy",
      "scope": "established-session",
      "adversary": [
        "A3"
      ],
      "assumptions": [
        "ideal-one-way-ratchet-step",
        "fresh-classical-dh-ratchet-input",
        "prior-ratchet-key-erasure"
      ],
      "proofModel": null,
      "proofLemma": null,
      "counterexampleStatus": "not-run",
      "residualRisk": "computational-ratchet-security-and-physical-zeroization-outside-symbolic-claim",
      "status": "unproved"
    },
    {
      "id": "SEC-011",
      "property": "double-ratchet-post-compromise-recovery",
      "scope": "established-session",
      "adversary": [
        "A3"
      ],
      "assumptions": [
        "ideal-one-way-ratchet-step",
        "fresh-uncompromised-classical-dh-ratchet-input",
        "atomic-durable-compare-and-commit"
      ],
      "proofModel": null,
      "proofLemma": null,
      "counterexampleStatus": "not-run",
      "residualRisk": "ongoing-post-quantum-post-compromise-recovery-explicit-nonclaim",
      "status": "unproved"
    },
    {
      "id": "SEC-012",
      "property": "replay-resistance",
      "scope": "protocol-line",
      "adversary": [
        "A0",
        "A1",
        "A6"
      ],
      "assumptions": [
        "ideal-record-authentication",
        "atomic-durable-compare-and-commit",
        "unique-record-coordinate"
      ],
      "proofModel": null,
      "proofLemma": null,
      "counterexampleStatus": "not-run",
      "residualRisk": "application-replay-and-fully-compromised-store-outside-model",
      "status": "unproved"
    },
    {
      "id": "SEC-013",
      "property": "state-rollback-resistance",
      "scope": "identity-and-session-state",
      "adversary": [
        "A0",
        "A3",
        "A6"
      ],
      "assumptions": [
        "atomic-durable-compare-and-commit",
        "monotonic-committed-state-generation"
      ],
      "proofModel": null,
      "proofLemma": null,
      "counterexampleStatus": "not-run",
      "residualRisk": "rollback-detection-under-fully-compromised-store-explicit-nonclaim",
      "status": "unproved"
    },
    {
      "id": "SEC-014",
      "property": "self-certifying-user-authority",
      "scope": "user-authority-genesis",
      "adversary": [
        "A0",
        "A4",
        "A6"
      ],
      "assumptions": [
        "domain-separated-genesis-key-derivation",
        "ideal-dual-signature-authentication",
        "canonical-authority-state-digest"
      ],
      "proofModel": null,
      "proofLemma": null,
      "counterexampleStatus": "not-run",
      "residualRisk": "management-and-recovery-key-compromise-remains-the-explicit-authority-boundary",
      "status": "unproved"
    },
    {
      "id": "SEC-015",
      "property": "route-migration-safety",
      "scope": "identity-and-transport",
      "adversary": [
        "A0"
      ],
      "assumptions": [
        "endpoint-authenticated-route-update",
        "monotonic-predecessor-bound-route-chain",
        "affiliation-state-binding"
      ],
      "proofModel": null,
      "proofLemma": null,
      "counterexampleStatus": "not-run",
      "residualRisk": "endpoint-route-signing-key-compromise-and-route-availability-outside-claim",
      "status": "unproved"
    },
    {
      "id": "SEC-016",
      "property": "management-and-recovery-transition-authorization",
      "scope": "user-authority-successors",
      "adversary": [
        "A0",
        "A4",
        "A6"
      ],
      "assumptions": [
        "exact-predecessor-authority-resolution",
        "ideal-dual-signature-authentication",
        "atomic-high-water-compare-and-commit"
      ],
      "proofModel": null,
      "proofLemma": null,
      "counterexampleStatus": "not-run",
      "residualRisk": "compromise-of-the-selected-predecessor-authority-key-composition-remains-the-explicit-boundary",
      "status": "unproved"
    },
    {
      "id": "SEC-017",
      "property": "endpoint-possession-authorization",
      "scope": "user-authority-device-admission",
      "adversary": [
        "A0",
        "A4",
        "A6"
      ],
      "assumptions": [
        "domain-separated-possession-proof",
        "exact-endpoint-state-digest",
        "ideal-dual-signature-authentication"
      ],
      "proofModel": null,
      "proofLemma": null,
      "counterexampleStatus": "not-run",
      "residualRisk": "endpoint-signing-key-compromise-remains-the-explicit-possession-boundary",
      "status": "unproved"
    },
    {
      "id": "SEC-018",
      "property": "acyclic-sibling-endpoint-authority-session-binding",